{
  "$schema": "https://json-schema.org/draft/2020-12/schema",
  "$id": "https://local.renderer/contracts/kakao-bizboard-input-1.2.0.schema.json",
  "title": "Kakao Bizboard Renderer Input 1.2.0",
  "description": "Public input contract. Defaults are materialized by the explicit applyDefaults stage after raw schema validation; JSON Schema default annotations are not executable behavior.",
  "type": "object",
  "additionalProperties": false,
  "required": [
    "schemaVersion",
    "channel",
    "placement",
    "template",
    "advertiser",
    "copy",
    "cta",
    "assets",
    "output"
  ],
  "properties": {
    "schemaVersion": {
      "const": "1.2.0"
    },
    "channel": {
      "const": "KAKAO_MOMENT"
    },
    "placement": {
      "const": "BIZBOARD"
    },
    "template": {
      "const": "OBJECT_RIGHT"
    },
    "canvas": {
      "type": "object",
      "additionalProperties": false,
      "required": [
        "width",
        "height"
      ],
      "properties": {
        "width": {
          "const": 1029
        },
        "height": {
          "const": 258
        }
      },
      "default": {
        "width": 1029,
        "height": 258
      }
    },
    "advertiser": {
      "type": "object",
      "additionalProperties": false,
      "required": [
        "text",
        "renderMode"
      ],
      "properties": {
        "text": {
          "type": "string",
          "minLength": 1,
          "maxLength": 40
        },
        "renderMode": {
          "const": "REQUIRE_IN_COPY"
        }
      }
    },
    "copy": {
      "type": "object",
      "additionalProperties": false,
      "required": [
        "headline",
        "subcopy"
      ],
      "properties": {
        "headline": {
          "type": "string",
          "minLength": 1,
          "maxLength": 80
        },
        "subcopy": {
          "type": "string",
          "minLength": 1,
          "maxLength": 100
        }
      }
    },
    "cta": {
      "description": "All registered shapes remain parseable. Only modes enabled by contracts/cta-registry.json may pass semantic validation.",
      "oneOf": [
        {
          "type": "object",
          "additionalProperties": false,
          "required": [
            "mode",
            "landingType"
          ],
          "properties": {
            "mode": {
              "const": "NONE"
            },
            "landingType": {
              "enum": [
                "DIRECT_URL",
                "ADVIEW",
                "KAKAO_SERVICE"
              ]
            },
            "label": {
              "type": "null",
              "default": null
            },
            "iconPath": {
              "type": "null",
              "default": null
            }
          }
        },
        {
          "type": "object",
          "additionalProperties": false,
          "required": [
            "mode",
            "landingType",
            "label",
            "iconPath"
          ],
          "properties": {
            "mode": {
              "const": "APP_DOWNLOAD"
            },
            "landingType": {
              "const": "APP_STORE"
            },
            "label": {
              "type": "string",
              "minLength": 2,
              "maxLength": 40
            },
            "iconPath": {
              "type": "string",
              "minLength": 1
            }
          }
        },
        {
          "type": "object",
          "additionalProperties": false,
          "required": [
            "mode",
            "landingType",
            "label"
          ],
          "properties": {
            "mode": {
              "const": "KAKAO_SERVICE_ACTION"
            },
            "landingType": {
              "type": "string",
              "minLength": 1
            },
            "label": {
              "type": "string",
              "minLength": 1,
              "maxLength": 40
            },
            "iconPath": {
              "type": [
                "string",
                "null"
              ],
              "default": null
            }
          }
        }
      ]
    },
    "assets": {
      "type": "object",
      "additionalProperties": false,
      "required": [
        "product"
      ],
      "properties": {
        "product": {
          "type": "object",
          "additionalProperties": false,
          "required": [
            "path"
          ],
          "properties": {
            "path": {
              "type": "string",
              "minLength": 1,
              "description": "Normalized project-relative reference. Absolute OS paths are prohibited in Canonical Input."
            },
            "expectedSha256": {
              "type": [
                "string",
                "null"
              ],
              "pattern": "^[a-fA-F0-9]{64}$",
              "default": null
            },
            "alphaTrim": {
              "const": true,
              "default": true
            }
          }
        }
      }
    },
    "render": {
      "type": "object",
      "additionalProperties": false,
      "properties": {
        "templateContractVersion": {
          "enum": ["1.3.0", "1.4.0", "1.5.0", "1.6.0"],
          "default": "1.6.0"
        },
        "includeDebugOverlay": {
          "const": false,
          "default": false
        },
        "pixelRatio": {
          "const": 1,
          "default": 1
        }
      },
      "default": {
        "templateContractVersion": "1.6.0",
        "includeDebugOverlay": false,
        "pixelRatio": 1
      }
    },
    "output": {
      "description": "directory and baseName resolve to a job directory below the trusted output root. Published file names inside that directory are output.png and render-manifest.json.",
      "type": "object",
      "additionalProperties": false,
      "required": [
        "directory",
        "baseName"
      ],
      "properties": {
        "directory": {
          "type": "string",
          "minLength": 1
        },
        "baseName": {
          "type": "string",
          "pattern": "^[A-Za-z0-9._-]+$",
          "minLength": 1,
          "maxLength": 120
        },
        "overwrite": {
          "type": "boolean",
          "default": false
        }
      }
    }
  }
}
