{
  "schemaVersion": "1.2.0",
  "channel": "KAKAO_MOMENT",
  "placement": "BIZBOARD",
  "template": "OBJECT_RIGHT",
  "advertiser": {
    "text": "자코모",
    "renderMode": "REQUIRE_IN_COPY"
  },
  "copy": {
    "headline": "자코모 프리미엄 소파",
    "subcopy": "거실을 바꾸는 선택"
  },
  "cta": {
    "mode": "NONE",
    "landingType": "DIRECT_URL"
  },
  "assets": {
    "product": {
      "path": "fixtures/valid/object-right__product__basic__pass.png"
    }
  },
  "output": {
    "directory": "out",
    "baseName": "cta-none-basic",
    "overwrite": false
  }
}
